{
  "entry_id": "b9f33cdb-ab69-46e4-90b5-40e2f1ae8d71",
  "intent_label": "drink",
  "label_correction": null,
  "label_status": "confirmed",
  "output_mode": "speech",
  "prompt_text": "Did you mean 'drink'?",
  "session_id": "session_abc123",
  "timestamp": "2025-07-10T12:00:00Z",
  "user_id": "user_xyz789",
  "user_response": "Yes, I did"
}
