{
  "entry_id": "84d5c8c7-0dde-4f42-bd2b-a586066d750f",
  "intent_label": "drink",
  "label_correction": null,
  "label_status": "confirmed",
  "output_mode": "speech",
  "prompt_text": "Did you mean 'drink'?",
  "session_id": "session_abc123",
  "timestamp": "2025-07-10T12:00:00Z",
  "user_id": "user_xyz789",
  "user_response": "Yes, I did"
}
